{
  "schema_version": "awesome-capture.vault-build-receipt/v1",
  "created_at": "2026-07-27T00:00:00Z",
  "config_schema": "awesome-capture.vault-config/v1",
  "config_sha256": "aaaaaaaaaaaaaaaaaaaaaaaaaaaaaaaaaaaaaaaaaaaaaaaaaaaaaaaaaaaaaaaa",
  "layout_version": "awesome-capture.vault-layout/v1",
  "link_style": "markdown",
  "vault_id": "bbbbbbbbbbbbbbbbbbbbbbbbbbbbbbbbbbbbbbbbbbbbbbbbbbbbbbbbbbbbbbbb",
  "plan_sha256": "cccccccccccccccccccccccccccccccccccccccccccccccccccccccccccccccc",
  "managed_directories": [
    "30 Resources"
  ],
  "managed_files": [
    {
      "path": "Home.md",
      "bytes": 100,
      "sha256": "dddddddddddddddddddddddddddddddddddddddddddddddddddddddddddddddd",
      "mode": "0644"
    }
  ],
  "producer": {
    "skill": "build-obsidian-vault",
    "contract_digest": "647ca3a9d65d2b11af4e6a4cbe65eabf7f40c778616de84f2ef07b5ce1359001"
  }
}
